{"idea": "i005", "persona": "competidor", "ataques": [
{"n": 1, "severidad": "MAJOR", "titulo": "Tres competidores locales ya venden stock con facturacion; el hueco depende de un segmento sin medir", "donde": "Competidores y Supuestos declarados: 'Hay comercios que no quieren migrar de facturador; su cantidad no está medida'", "problema": "YoFacturo (catalogo, CFE e inventario integrados), Fixed (stock FIFO en su plan caro) y gestionUltimate (stock unificado local y ecommerce desde el punto de venta) ya cubren el problema para quien factura con ellos. La idea solo se diferencia para el comercio que se queda con otro facturador y no quiere migrar, y admite que no sabe cuantos son. Si ese segmento es chico o no paga, el hueco es un nicho que nadie atiende porque no rinde. La propia ficha de YoFacturo ofrece prueba gratis de un mes, o sea que migrar cuesta poco.", "tipo": "evidencia", "evidencia": ["F-comercio-retail-006", "F-ataque-r1-m01-i005-cliente-001", "F-ataque-r1-m01-i005-cliente-002"]},
{"n": 2, "severidad": "MAJOR", "titulo": "La carga periodica de comprobantes reproduce el dolor de la carga doble que dice resolver", "donde": "Solucion y Riesgos: 'la carga periodica es trabajo nuevo y el piloto la mide'", "problema": "El dolor citado (F-comercio-retail-006) es cargar datos dos veces porque facturacion e inventario van separados. La idea obliga al dueno a exportar y subir XML, CSV, PDF o fotos de compras y ventas, y a confirmar emparejamientos dudosos; si no carga en 14 dias el stock se marca no confiable. Es una segunda carga manual fuera del facturador, y los competidores la eliminan porque el stock se descuenta al facturar. El diferencial frente a ellos es peor en la dimension que la idea eligio como dolor, y la idea reconoce que no sabe cuanto trabajo agrega.", "tipo": "evidencia", "evidencia": ["F-comercio-retail-006"]},
{"n": 3, "severidad": "MAJOR", "titulo": "Un competidor puede copiar la funcion en un trimestre", "donde": "Solucion: importar comprobantes y asociar lineas a productos con embeddings y reglas", "problema": "Un facturador como Fixed, YoFacturo o gestionUltimate ya tiene el catalogo y las lineas de sus propias facturas, y solo le faltaria un importador de CSV o XML de compras de terceros, que es una funcion acotada. Los componentes de la idea (parser de CFE, emparejamiento con embeddings, libro de movimientos) no son una barrera: es integracion de servicios conocidos. La idea no explica por que no lo haria un competidor con clientes ya cautivos y canal propio. No hay ficha que muestre que lo intentaron y fracasaron, ni que no les interesa.", "tipo": "opinion", "evidencia": []},
{"n": 4, "severidad": "MAJOR", "titulo": "La demanda de stock de terceros no tiene ninguna ficha; la unica sobre el dolor es marketing de un competidor", "donde": "Problema: 'Hay pago por stock... Las pymes carecen de herramientas digitales... son 97%'", "problema": "El dolor se apoya en el blog de YoFacturo, que vende el producto rival y no mide el costo (la idea lo admite). Las fichas F-comercio-retail-004 (pymes sin herramientas digitales completas, e-commerce) y F-comercio-retail-010 (97% de las empresas son mipymes, declaracion ministerial de 2020) son contexto generico: no dicen nada sobre stock, agotados ni disposicion a pagar por una herramienta separada del facturador. 'Fixed cobra mas por stock' muestra que se paga por stock dentro del facturador, no por una capa externa. El costo del agotado y el precio son supuestos.", "tipo": "evidencia", "evidencia": ["F-comercio-retail-006", "F-comercio-retail-004", "F-comercio-retail-010", "F-defensa-r1-m01-i005-001"]},
{"n": 5, "severidad": "MAJOR", "titulo": "Referencia de precio mal armada: el comercio paga la capa nueva ademas de su facturador actual", "donde": "Monetizacion: 'Referencia: el escalón de stock de Fixed cuesta UYU 1.160 más por mes, unos USD 35'", "problema": "La comparacion con el salto de plan de Fixed (UYU 2.140 contra 980, o sea UYU 1.160 de diferencia) es aritmeticamente correcta, pero el cliente objetivo no esta en Fixed: sigue pagando su facturador y suma USD 12 a 20 mensuales mas, con trabajo de carga. Su alternativa real es el modulo de stock de su propio facturador o una planilla, cuyo precio no esta en ninguna ficha. La ficha de precio de Fixed ademas tiene extracto 'no verificable' en la defensa. Con meta de 150 comercios y canal contable como supuestos, el ingreso maximo seria de unos USD 1.800 a 3.000 al mes, sin ficha de que un contador recomiende una herramienta ajena al facturador del cliente.", "tipo": "evidencia", "evidencia": ["F-defensa-r1-m01-i005-001", "F-comercio-retail-001"]},
{"n": 6, "severidad": "MINOR", "titulo": "Sin contactos para validar ni comercios piloto antes de diciembre de 2026", "donde": "Supuestos declarados: 'El equipo puede conseguir 3 a 5 comercios piloto; el perfil no declara contactos'", "problema": "R4 pide usuarios que el equipo pueda contactar desde Uruguay para validar la idea antes de diciembre de 2026, y la tabla de contactos de constraints.md esta sin completar. El piloto de 8 semanas con 3 a 5 comercios en el semestre 2 es una dependencia externa sin plan B. Montevideo es contactable en general, por eso no es fatal, pero la validacion de que existen comercios que no migran de facturador no tiene hoy ningun camino concreto.", "tipo": "opinion", "evidencia": []}
], "nuevas_fichas": []}
