{"idea": "i011", "persona": "cliente", "ataques": [
{"n": 1, "severidad": "MAJOR", "titulo": "La demanda en Uruguay no tiene ninguna ficha: el dolor central viene de Colombia", "donde": "Problema: 'Cada pregunta termina en planillas armadas a mano por administración'; Supuestos: 'Los colegios uruguayos también usan sistemas no integrados'", "problema": "Como director o administrador, lo que la idea afirma como dolor (cruzar matrícula, cobranza y asistencia en planillas manuales) no está respaldado en Uruguay por ninguna ficha. F-educacion-007 es de Colombia, habla de plataformas 'no integradas a su gestión diaria' y de duplicar tareas administrativas, no de que la dirección no pueda consultar datos ni de planillas armadas a mano; la ficha misma se declara 'no uruguaya'. F-educacion-004 prueba que hay crisis y cierres, pero no dice nada sobre datos dispersos ni sobre que la dirección quiera preguntas en lenguaje natural. La frase sobre planillas a mano es una afirmación de la idea, no de la ficha. La demanda queda en una sola ficha extranjera más una ficha de contexto sectorial.", "tipo": "evidencia", "evidencia": ["F-educacion-007", "F-educacion-004"]},
{"n": 2, "severidad": "MAJOR", "titulo": "La crisis que la idea usa como argumento es también el motivo por el que no habría presupuesto", "donde": "Problema y Monetización: suscripción de USD 60 a 120 por mes por colegio, 'paga el colegio'", "problema": "F-educacion-004 habla de tres cierres y de fusiones por crisis del sector. Un colegio en ese estado recorta gastos, no suma una suscripción nueva para consultas de gestión; la propia idea lo admite en Riesgos y no lo resuelve. Mi presupuesto de TI es mínimo y ya probé herramientas que no cumplieron: la idea no dice quién decide la compra (¿el director, la administración, la fundación o congregación dueña?), de qué partida sale, ni cuánto me cuesta hoy el problema en horas de administración. USD 60 a 120 por mes es un supuesto declarado sin una sola señal de pago, y la 'tarifa única de puesta en marcha de los importadores' no tiene monto. Con unos 220 colegios agrupados (F-educacion-004) y pocos dispuestos a pagar, el techo del mercado inicial nunca se estima.", "tipo": "evidencia", "evidencia": ["F-educacion-004"]},
{"n": 3, "severidad": "MAJOR", "titulo": "R7: el piloto con datos reales depende de un colegio que no existe en la tabla de contactos", "donde": "Semestre 2: 'Demo: piloto con datos reales de un colegio'; Supuestos: 'Se consigue un colegio piloto antes de diciembre de 2026'", "problema": "R7 exige un socio identificado en la tabla de contactos si el proyecto depende de datos a los que el equipo no tiene acceso legal. La tabla de constraints.md está toda en <<COMPLETAR>>: no hay ningún colegio ni persona. El semestre 1 funciona con datos de prueba, pero el valor del producto (importadores que sobreviven a exportaciones reales de 2 o 3 sistemas no nombrados, Text-to-SQL con exactitud medida, piloto del business case) solo se prueba con datos reales de cobranza y familias. La idea ni siquiera identifica cuáles son esos 2 o 3 sistemas que los colegios uruguayos usan: las fichas solo muestran dos suites que reemplazan todo. Sin socio, el plan B es datos sintéticos, que no demuestran nada ante un cliente. Además, como cliente, a un equipo de estudiantes yo no le entrego listados de familias con deuda sin garantías.", "tipo": "opinion", "evidencia": []},
{"n": 4, "severidad": "MAJOR", "titulo": "Competencia mal leída: la ausencia de consultas libres en una ficha no prueba que el hueco exista", "donde": "Competidores: 'la ficha no muestra consultas libres sobre datos de otros sistemas' / 'la ficha no menciona análisis en lenguaje natural'", "problema": "La diferenciación se apoya en lo que las fichas no dicen. F-educacion-005 es una página de comparación de software sin precios y con descripción resumida; F-educacion-006 es una nota de 2019 sobre la empresa. Que no mencionen análisis en lenguaje natural no demuestra que los productos no lo ofrezcan o no lo vayan a agregar, y ambos ya concentran facturación, asistencia y seguimiento (F-educacion-005), es decir, los datos que la idea quiere cruzar. Además se ignoran las alternativas que de verdad uso hoy para este problema: planillas con tablas dinámicas, exportar a Excel o Google Sheets con sus asistentes de IA incorporados, o herramientas de tableros genéricas conectadas a CSV. Un competidor con la suite y los datos copia una capa Text-to-SQL con un modelo de API, que cuesta un par de semanas. La barrera real (importadores por sistema) es justo la parte que la idea reconoce como mantenimiento creciente.", "tipo": "evidencia", "evidencia": ["F-educacion-005", "F-educacion-006"]},
{"n": 5, "severidad": "MAJOR", "titulo": "Datos de menores y cobranza se envían a una API externa sin camino de cumplimiento", "donde": "Stack: Gemini 2.5 Flash API; Riesgos: 'cumplimiento de Ley 18.331 y control de acceso'", "problema": "El riesgo se nombra pero no se resuelve (R6 pide un camino de cumplimiento realista). Text-to-SQL con LLM externo implica mandar a un tercero esquema, glosario y muchas veces resultados con datos de alumnos y familias morosas; es información sensible de menores y de situación económica. La idea no dice si el contenido sale del país, qué plan de la API garantiza que no se use para entrenamiento (el costo calculado dice 'no se cuenta la capa gratuita', pero no vincula esto con privacidad), ni quién es el responsable de la base de datos ante la URCDP, ni cómo se obtiene el consentimiento de las familias. Como cliente, esa es la primera pregunta que me haría mi asesor y mi comisión; hoy la respuesta es 'riesgo'. Es opinión: no hay ficha sobre la regulación aplicable.", "tipo": "opinion", "evidencia": []},
{"n": 6, "severidad": "MINOR", "titulo": "El costo asume un solo servidor chico para desarrollo, pruebas y 1 a 3 colegios con datos reales", "donde": "Costo: 'Servidor AWS Lightsail Linux 2 GB, USD 144'", "problema": "Un servidor de 2 GB debe correr la app, PostgreSQL, importadores y el orquestador de agentes, sin ambiente separado de pruebas y con datos de hasta 3 colegios. Si el piloto exige aislar datos por colegio o un entorno de pruebas distinto, el total se acerca al tope de USD 300. El total de USD 189 deja margen de USD 111, así que no viola R1, pero la estimación de tokens (30 millones de entrada) tampoco tiene fuente sobre cuántas preguntas ni cuánto contexto de esquema por consulta, y 'Dominio y DNS' es estimación sin fuente (el propio chequeo lo avisa). Es un problema menor de supuestos, no una violación.", "tipo": "opinion", "evidencia": []},
{"n": 7, "severidad": "MINOR", "titulo": "Cambiar cómo trabaja mi gente: el flujo exige exportar a mano y mantener un glosario", "donde": "Solución: 'consolida exportaciones' y 'catálogo semántico de tablas y glosario del colegio'", "problema": "Para que funcione, alguien de administración tiene que exportar CSV de cada sistema con regularidad y definir el glosario del colegio (qué es 'moroso', qué es 'nivel'); la idea declara como supuesto que los sistemas exportan a CSV o planilla, sin ficha. No hay integración directa con lo que ya uso, así que el dato siempre estará desactualizado y la tarea manual se suma a las existentes en vez de reemplazarlas. Si las respuestas son incorrectas una vez, mi dirección deja de confiar, y el riesgo que la idea cita (decisiones malas) cae sobre mí, no sobre el equipo.", "tipo": "opinion", "evidencia": []}
], "nuevas_fichas": []}
