{
 "idea": "i015",
 "persona": "cliente",
 "ataques": [
  {
   "n": 1,
   "severidad": "MAJOR",
   "titulo": "El costo 0 de WhatsApp no cubre las alertas de patrones nuevos que el plan pago promete",
   "donde": "Costos: fila WhatsApp Cloud API (0 USD) y Solución/plan de negocio (alertas de patrones nuevos)",
   "problema": "La idea justifica USD 0 porque el usuario inicia cada consulta y no se envian plantillas pagas. Pero el producto que se cobra incluye alertas de patrones nuevos reportados por otros usuarios: son mensajes iniciados por el sistema, fuera de la ventana de 24 horas, que exigen plantilla. Segun la documentacion de WhatsApp, las plantillas de marketing siempre se cobran y las de utilidad se cobran fuera de la ventana abierta. El feature que justifica el USD 6 por mes contradice el supuesto de costo cero, y no hay estimacion de cuanto cuesta alertar a 400 pymes. El total de USD 115 deja margen, pero el supuesto declarado es falso para el plan pago.",
   "tipo": "evidencia",
   "evidencia": [
    "F-ataque-r1-m08-i015-cliente-002"
   ]
  },
  {
   "n": 2,
   "severidad": "MAJOR",
   "titulo": "La demanda de los vendedores no esta respaldada: las fichas no hablan de vendedores ni de perdidas",
   "donde": "Problema y Usuario: 'Quien vende por redes recibe a diario mensajes, links y comprobantes de desconocidos'; 'la proteccion existente actua del lado del banco y despues del pago'",
   "problema": "Las tres fichas citadas son datos agregados: denuncias totales (F-fintech-seguros-004, no distingue victimas vendedoras), tipologia del BCU (F-fintech-seguros-006, lista Marketplace como tipo pero no dice que haya vendedores perdiendo dinero por comprobantes falsos) y volumen de transacciones (F-comercio-retail-001, nada sobre fraude). Ninguna muestra a un vendedor uruguayo con perdidas, ni cuanto cuesta. La afirmacion de que la proteccion existente actua solo del lado del banco no esta en las fichas ni en Supuestos. Como duenio de una pyme, no veo en estas fichas que yo pierda plata por esto hoy; la demanda es opinion del autor, solo declarada en parte.",
   "tipo": "evidencia",
   "evidencia": [
    "F-fintech-seguros-004",
    "F-fintech-seguros-006",
    "F-comercio-retail-001"
   ]
  },
  {
   "n": 3,
   "severidad": "MAJOR",
   "titulo": "La mitigacion principal para comprobantes falsos ya es gratis y no necesita un bot",
   "donde": "Solucion: 'confirmar el credito en la cuenta, no en la captura'; Competidores: 'Ninguno respaldado por fichas'",
   "problema": "El propio consejo que da el bot para la captura de comprobante (mirar la cuenta) es la defensa estandar y gratuita que difunden bancos y fintechs de la region. Hoy el vendedor lo resuelve con su homebanking en 10 segundos y sin pagar. El bot solo agrega valor si detecta una falsificacion mejor que ese chequeo, pero eso es un supuesto sin evidencia ('un modelo con vision puede detectar inconsistencias con precision util'), y un comprobante bien editado no deja huella visible. No explica por que alguien pagaria USD 6 por mes por algo que se reemplaza con abrir la app del banco.",
   "tipo": "evidencia",
   "evidencia": [
    "F-ataque-r1-m08-i015-cliente-001"
   ]
  },
  {
   "n": 4,
   "severidad": "MAJOR",
   "titulo": "Disposicion a pagar y 400 pymes pagas sin ninguna base",
   "donde": "Monetizacion: 'Con 400 pymes pagas serian unos USD 28.800 al ano'",
   "problema": "El 400 no sale de ninguna ficha ni de un tamano de mercado: no hay cuantas pymes venden por redes en Uruguay, ni conversion freemium a pago. Las fichas de pymes de e-commerce (F-comercio-retail-006) muestran baja digitalizacion: 92% sin sistema de inventario automatizado, es decir, equipos que no pagan por herramientas basicas. Con 10 consultas gratis por mes, un vendedor ocasional nunca paga, y quien recibe pocos comprobantes tampoco. Es un prepago preventivo, y la idea misma lista 'baja disposicion a pagar' como riesgo. El canal de camaras o gremios no tiene ningun contacto ni ficha detras (la tabla de contactos esta sin completar).",
   "tipo": "evidencia",
   "evidencia": [
    "F-comercio-retail-006"
   ]
  },
  {
   "n": 5,
   "severidad": "MAJOR",
   "titulo": "Falso negativo en el momento de despachar: el costo del error recae en el cliente",
   "donde": "Riesgos: 'Falsos negativos pueden dar falsa seguridad; se comunica como ayuda, no garantia'",
   "problema": "Si el bot dice riesgo bajo y la estafa ocurre, el vendedor pierde la mercaderia y el bot no responde por nada. Como cliente no pago por una herramienta que no se hace cargo del error y que ademas me puede dar confianza falsa. El MVP no tiene meta de precision ni de falsos negativos definida; el set etiquetado lo arma el propio equipo, sin datos reales de comprobantes falsos (que nadie les va a dar sin un socio). Los estafadores cambian de patron, y la base de patrones esta armada solo sobre una nota de prensa del BCU.",
   "tipo": "opinion",
   "evidencia": []
  },
  {
   "n": 6,
   "severidad": "MINOR",
   "titulo": "Datos de terceros reportados y capturas de comprobantes bajo Ley 18.331 sin camino de cumplimiento concreto",
   "donde": "Riesgos: 'Guardar datos de terceros reportados exige cuidado bajo la Ley 18.331'; historial en plan de negocio",
   "problema": "Las capturas de comprobantes contienen nombres, cuentas y montos de terceros, y el panel guarda historial y alertas basadas en reportes de otros usuarios. La idea lo menciona como riesgo pero no define base legal, retencion ni como se evita difamar a una persona marcada como estafadora. Como duenio de pyme no voy a mandar a un equipo de estudiantes los datos de mis clientes sin saber quien responde por ellos. R6 exige un camino realista de cumplimiento y aqui es solo una frase.",
   "tipo": "opinion",
   "evidencia": []
  }
 ],
 "nuevas_fichas": [
  {
   "id": "F-ataque-r1-m08-i015-cliente-001",
   "sector": "transversal",
   "hallazgo": "Naranja X (Argentina, marzo 2026) explica que una captura de comprobante no es dinero: el unico comprobante valido es el propio homebanking o app, y hasta ver el monto acreditado la venta no existe. La defensa contra el comprobante falso es gratuita y consiste en mirar la cuenta.",
   "source_url": "https://www.naranjax.com/blog/la-estafa-del-comprobante-fantasma",
   "source_title": "La estafa del comprobante fantasma: una captura de pantalla no es dinero",
   "source_date": "2026-03-13",
   "source_type": "otro",
   "geografia": "AR",
   "confianza": "media",
   "retrieved_at": "2026-10-08T12:00:00",
   "extracto": "El único comprobante válido es tu propio Homebanking o app."
  },
  {
   "id": "F-ataque-r1-m08-i015-cliente-002",
   "sector": "transversal",
   "hallazgo": "Segun la documentacion de precios de WhatsApp Business Platform, solo los mensajes no plantilla dentro de la ventana de 24 horas abierta por el usuario son gratis; las plantillas de marketing siempre se cobran y las de utilidad se cobran fuera de la ventana abierta.",
   "source_url": "https://developers.facebook.com/docs/whatsapp/pricing",
   "source_title": "WhatsApp Business Platform pricing",
   "source_date": "desconocida",
   "source_type": "precios",
   "geografia": "GLOBAL",
   "confianza": "alta",
   "retrieved_at": "2026-10-08T12:00:00",
   "extracto": "All non-template messages are free"
  }
 ]
}