{
  "idea": "i002",
  "persona": "cliente",
  "ataques": [
    {
      "n": 1,
      "severidad": "MAJOR",
      "titulo": "El dolor central (no poder confirmar transferencias) no tiene ficha: la citada habla de cuadernos",
      "donde": "Problema: 'el almacén que las acepta no confirma al instante la llegada del dinero ni cuadra su caja' (F-comercio-retail-006)",
      "problema": "F-comercio-retail-006 es marketing de un competidor sobre cuadernos, stock a ojo y comprobantes perdidos; no dice nada de confirmar transferencias. Como cliente, hoy veo la llegada del dinero en la app o el aviso del propio banco, y la idea no explica por qué eso no me alcanza. La única base es el supuesto 'hoy no hay forma simple de confirmar', que es justo lo que decide si pago o no. La demanda queda como opinión de quien escribió la idea.",
      "tipo": "evidencia",
      "evidencia": ["F-comercio-retail-006"]
    },
    {
      "n": 2,
      "severidad": "MAJOR",
      "titulo": "Pedir al almacenero que configure reenvío automático de emails del banco contradice 'no cambiar cómo trabaja mi gente'",
      "donde": "Solución, paso 2: 'El comercio reenvía automáticamente los avisos por email de su banco'",
      "problema": "El usuario objetivo lleva la caja en cuadernos y, según la ficha, necesita incentivos para adoptar pagos digitales. Se le pide crear reglas de reenvío en su correo, y además que cada cliente use un código de referencia al transferir. Dos fricciones de adopción, una en cada lado del mostrador, sin evidencia de que alguien las acepte (el supuesto lo reconoce, sin respaldo). Y el reenvío entrega a terceros avisos bancarios con datos de pagadores y de la cuenta del comercio: a un equipo de estudiantes no se lo daría sin garantías claras.",
      "tipo": "evidencia",
      "evidencia": ["F-fintech-seguros-003", "F-comercio-retail-006"]
    },
    {
      "n": 3,
      "severidad": "MAJOR",
      "titulo": "El ahorro que justifica el precio depende de que los clientes pasen a transferir, y eso no está respaldado",
      "donde": "Monetización: 'pasando la mitad a transferencias ahorra 1.500' contra 350 pesos por mes",
      "problema": "El ahorro solo existe si los clientes del almacén dejan de pagar con tarjeta o MercadoPago, algo que el comercio no controla. Las comisiones citadas son de 2022 (F-fintech-seguros-005) y el crecimiento de 50% de transferencias (F-fintech-seguros-002) es agregado nacional, no del microcomercio ni del interior. Sin ese cambio de hábito, la app cuesta 350 pesos y no ahorra nada. Además la comparación con el POS es engañosa: el POS me da cobro con tarjeta, y esto no lo reemplaza.",
      "tipo": "evidencia",
      "evidencia": ["F-fintech-seguros-005", "F-fintech-seguros-002"]
    },
    {
      "n": 4,
      "severidad": "MAJOR",
      "titulo": "Que los bancos uruguayos manden emails de transferencia recibida con DKIM es la base técnica y no está verificado",
      "donde": "Supuestos: 'Al menos 3 bancos avisan por email con firma DKIM'; Alcance S1: parsers para 3 bancos",
      "problema": "Todo el producto depende de ese supuesto, declarado pero sin ninguna ficha. Si los bancos no avisan por email al receptor, o avisan con demora, o el reenvío rompe la firma, no hay producto, y el plan B (extracto CSV) es lo que ya hago a mano a fin de mes. Para mí el valor es la inmediatez y el plan B no la da. Una dependencia externa crítica sin plan B equivalente.",
      "tipo": "opinion",
      "evidencia": []
    },
    {
      "n": 5,
      "severidad": "MAJOR",
      "titulo": "Diferenciación débil: no se explica por qué bancos o pagos interoperables no darían esta confirmación",
      "donde": "Competidores y Riesgos: 'Bancos o pagos interoperables podrían ofrecer esta confirmación'",
      "problema": "Los tres competidores listados no atacan este problema, así que la tabla no prueba que el hueco exista: puede ser que ya se resuelva con la notificación de la app bancaria. La propia idea admite que bancos o pagos interoperables pueden copiarlo, y su solución es un parche sobre emails ajenos, que cualquier cambio de formato rompe. Como cliente, no vería por qué pagar una capa frágil encima de algo que mi banco puede dar gratis.",
      "tipo": "evidencia",
      "evidencia": ["F-comercio-retail-007", "F-comercio-retail-008"]
    },
    {
      "n": 6,
      "severidad": "MINOR",
      "titulo": "Disposición a pagar y tamaño de mercado respaldados con datos genéricos de microempresas",
      "donde": "Problema: 'Hay unas 188.000 microempresas con poco asesoramiento financiero'; Monetización: meta de 300 comercios",
      "problema": "F-comercio-retail-002 habla de acceso a crédito y financiamiento, no de pagos ni de gasto en herramientas. No dice cuántas son almacenes o kioscos con transferencias ni cuántos pagarían suscripción. La idea reconoce que precio y meta son hipótesis y que no hay contactos para el canal; entonces nadie decide la compra y no se sabe de qué presupuesto saldría. El piloto de 8 a 10 comercios también depende de contactos que hoy no existen.",
      "tipo": "evidencia",
      "evidencia": ["F-comercio-retail-002"]
    }
  ],
  "nuevas_fichas": []
}
